{
  "schemaVersion": "reader-runtime-state.v1",
  "stateId": "reader.state.example",
  "userId": "person.operator",
  "packageId": "projection.package.example.html",
  "graphVersionId": "graph.example.epub.v2",
  "currentAnchorId": "anchor.example.evidence",
  "progress": {
    "percentage": 0.42,
    "displayLabel": "42%"
  },
  "layoutProfile": {
    "fontScale": 1.0,
    "lineHeight": 1.6,
    "theme": "light",
    "viewport": {
      "width": 390,
      "height": 844
    }
  },
  "runtimeLocations": [
    {
      "anchorId": "anchor.example.evidence",
      "projectionType": "html",
      "locator": {
        "scrollY": 1280
      }
    }
  ],
  "annotationRefs": ["annotation.example.highlight"],
  "updatedAt": "2026-05-13T16:00:00Z"
}
